post_id,text,post_text,shared_text,original_text,time,timestamp,image,image_lowquality,images,images_description,images_lowquality,images_lowquality_description,video,video_duration_seconds,video_height,video_id,video_quality,video_size_MB,video_thumbnail,video_watches,video_width,likes,comments,shares,post_url,link,links,user_id,username,user_url,is_live,factcheck,shared_post_id,shared_time,shared_user_id,shared_username,shared_post_url,available,comments_full,reactors,w3_fb_url,reactions,reaction_count,with,page_id,sharers,image_id,image_ids,was_live,Sentiment,Polarity
10159993009934641,"The Football Association said it will work with English football clubs to address recent incidents of fans entering the pitch, vowing to review its regulations to put a stop to unruly fan behavior

CNN.COM
English FA to review regulations following recent incidents of 'anti-social' behavior from fans","The Football Association said it will work with English football clubs to address recent incidents of fans entering the pitch, vowing to review its regulations to put a stop to unruly fan behavior","CNN.COM
English FA to review regulations following recent incidents of 'anti-social' behavior from fans",,2022-05-21 17:00:17,1653134417,https://cdn.cnn.com/cnnnext/dam/assets/220520201552-01-everton-crystal-palace-0519-rstricted-super-tease.jpg,https://external.fkhi17-1.fna.fbcdn.net/safe_image.php?w=476&h=249&url=https%3A%2F%2Fcdn.cnn.com%2Fcnnnext%2Fdam%2Fassets%2F220520201552-01-everton-crystal-palace-0519-rstricted-super-tease.jpg&cfs=1&jq=75&ext=jpg&utld=cnn.com&_nc_oe=7024e&_nc_sid=505865&_nc_o2e=1&ccb=3-6&_nc_hash=AQFSXPGpPYbIxK97,['https://cdn.cnn.com/cnnnext/dam/assets/220520201552-01-everton-crystal-palace-0519-rstricted-super-tease.jpg'],[],['https://external.fkhi17-1.fna.fbcdn.net/safe_image.php?w=476&h=249&url=https%3A%2F%2Fcdn.cnn.com%2Fcnnnext%2Fdam%2Fassets%2F220520201552-01-everton-crystal-palace-0519-rstricted-super-tease.jpg&cfs=1&jq=75&ext=jpg&utld=cnn.com&_nc_oe=7024e&_nc_sid=505865&_nc_o2e=1&ccb=3-6&_nc_hash=AQFSXPGpPYbIxK97'],[None],,,,,,,,,,89,7,14,https://facebook.com/cnninternational/posts/10159993009934641,https://cnn.it/3LtIYVO,[],18793419640,CNN International,https://facebook.com/cnninternational/?locale2=en_US&__tn__=C-R,False,,,,,,,True,,,,,,,18793419640,,,[],False,0,0.33202338
10159992945719641,"From alternative fuels to rationing trips: A guide to more sustainable flying ✈️

CNN.COM
From alternative fuels to rationing trips: A guide to more sustainable flying",From alternative fuels to rationing trips: A guide to more sustainable flying ✈️,"CNN.COM
From alternative fuels to rationing trips: A guide to more sustainable flying",,2022-05-21 16:00:13,1653130813,https://cdn.cnn.com/cnnnext/dam/assets/220505210641-01-green-vacations-airport-super-tease.jpg,https://external.fkhi17-1.fna.fbcdn.net/safe_image.php?w=476&h=249&url=https%3A%2F%2Fcdn.cnn.com%2Fcnnnext%2Fdam%2Fassets%2F220505210641-01-green-vacations-airport-super-tease.jpg&cfs=1&jq=75&ext=jpg&utld=cnn.com&_nc_oe=7024d&_nc_sid=505865&_nc_o2e=1&ccb=3-6&_nc_hash=AQFqjoXla2BO6-W4,['https://cdn.cnn.com/cnnnext/dam/assets/220505210641-01-green-vacations-airport-super-tease.jpg'],[],['https://external.fkhi17-1.fna.fbcdn.net/safe_image.php?w=476&h=249&url=https%3A%2F%2Fcdn.cnn.com%2Fcnnnext%2Fdam%2Fassets%2F220505210641-01-green-vacations-airport-super-tease.jpg&cfs=1&jq=75&ext=jpg&utld=cnn.com&_nc_oe=7024d&_nc_sid=505865&_nc_o2e=1&ccb=3-6&_nc_hash=AQFqjoXla2BO6-W4'],[None],,,,,,,,,,119,5,26,https://facebook.com/cnninternational/posts/10159992945719641,https://cnn.it/3PCj8Ck,[],18793419640,CNN International,https://facebook.com/cnninternational/?locale2=en_US&__tn__=C-R,False,,,,,,,True,,,,,,,18793419640,,,[],False,0,0.44548965
10159992477949641,"He was convicted of starting the Dolan Fire -- which critically injured a firefighter, destroyed homes and killed a dozen endangered condors

CNN.COM
Man convicted of starting California wildfire that killed endangered condors was sentenced to 24 years in prison","He was convicted of starting the Dolan Fire -- which critically injured a firefighter, destroyed homes and killed a dozen endangered condors","CNN.COM
Man convicted of starting California wildfire that killed endangered condors was sentenced to 24 years in prison",,2022-05-21 08:00:12,1653102012,https://cdn.cnn.com/cnnnext/dam/assets/220520163445-dolan-fire-file-2020-super-tease.jpg,https://external.fkhi17-1.fna.fbcdn.net/safe_image.php?w=476&h=249&url=https%3A%2F%2Fcdn.cnn.com%2Fcnnnext%2Fdam%2Fassets%2F220520163445-dolan-fire-file-2020-super-tease.jpg&cfs=1&jq=75&ext=jpg&utld=cnn.com&_nc_oe=7024d&_nc_sid=505865&_nc_o2e=1&ccb=3-6&_nc_hash=AQF7wiKpX4PFwjdh,['https://cdn.cnn.com/cnnnext/dam/assets/220520163445-dolan-fire-file-2020-super-tease.jpg'],[],['https://external.fkhi17-1.fna.fbcdn.net/safe_image.php?w=476&h=249&url=https%3A%2F%2Fcdn.cnn.com%2Fcnnnext%2Fdam%2Fassets%2F220520163445-dolan-fire-file-2020-super-tease.jpg&cfs=1&jq=75&ext=jpg&utld=cnn.com&_nc_oe=7024d&_nc_sid=505865&_nc_o2e=1&ccb=3-6&_nc_hash=AQF7wiKpX4PFwjdh'],[None],,,,,,,,,,347,48,27,https://facebook.com/cnninternational/posts/10159992477949641,https://cnn.it/3MEIBcu,[],18793419640,CNN International,https://facebook.com/cnninternational/?locale2=en_US&__tn__=C-R,False,,,,,,,True,,,,,,,18793419640,,,[],False,0,0.00023114681
10159992303434641,"Trump had until Friday to purge the contempt order issued by Judge Arthur Engoron on April 25, and paid the fine Thursday.

CNN.COM
Trump has paid his $110K fine for contempt of court","Trump had until Friday to purge the contempt order issued by Judge Arthur Engoron on April 25, and paid the fine Thursday.","CNN.COM
Trump has paid his $110K fine for contempt of court",,2022-05-21 05:01:34,1653091294,https://cdn.cnn.com/cnnnext/dam/assets/220518132344-donald-trump-file-051422-super-tease.jpg,https://external.fkhi17-1.fna.fbcdn.net/safe_image.php?w=476&h=249&url=https%3A%2F%2Fcdn.cnn.com%2Fcnnnext%2Fdam%2Fassets%2F220518132344-donald-trump-file-051422-super-tease.jpg&cfs=1&jq=75&ext=jpg&utld=cnn.com&_nc_oe=7024e&_nc_sid=505865&_nc_o2e=1&ccb=3-6&_nc_hash=AQFy2rzbwqfkb8Hv,['https://cdn.cnn.com/cnnnext/dam/assets/220518132344-donald-trump-file-051422-super-tease.jpg'],[],['https://external.fkhi17-1.fna.fbcdn.net/safe_image.php?w=476&h=249&url=https%3A%2F%2Fcdn.cnn.com%2Fcnnnext%2Fdam%2Fassets%2F220518132344-donald-trump-file-051422-super-tease.jpg&cfs=1&jq=75&ext=jpg&utld=cnn.com&_nc_oe=7024e&_nc_sid=505865&_nc_o2e=1&ccb=3-6&_nc_hash=AQFy2rzbwqfkb8Hv'],[None],,,,,,,,,,164,79,32,https://facebook.com/cnninternational/posts/10159992303434641,https://cnn.it/3LAMn5h,[],18793419640,CNN International,https://facebook.com/cnninternational/?locale2=en_US&__tn__=C-R,False,,,,,,,True,,,,,,,18793419640,,,[],False,0,0.00019907951
10159992174009641,"A federal judge in Louisiana has blocked the Biden administration from ending a Trump-era pandemic restriction at the US-Mexico border

CNN.COM
Federal judge blocks for now Biden administration from lifting Title 42",A federal judge in Louisiana has blocked the Biden administration from ending a Trump-era pandemic restriction at the US-Mexico border,"CNN.COM
Federal judge blocks for now Biden administration from lifting Title 42",,2022-05-21 03:05:10,1653084310,https://media.cnn.com/api/v1/images/stellar/prod/220516170426-migrants-mexico-border-file-120221.jpg?c=16x9&q=w_800%2Cc_fill,https://external.fkhi17-1.fna.fbcdn.net/safe_image.php?w=476&h=249&url=https%3A%2F%2Fmedia.cnn.com%2Fapi%2Fv1%2Fimages%2Fstellar%2Fprod%2F220516170426-migrants-mexico-border-file-120221.jpg%3Fc%3D16x9%26q%3Dw_800%252Cc_fill&cfs=1&jq=75&ext=jpg&utld=cnn.com&_nc_oe=7024e&_nc_sid=505865&_nc_o2e=1&ccb=3-6&_nc_hash=AQGa_CnnQCd7SWJV,['https://media.cnn.com/api/v1/images/stellar/prod/220516170426-migrants-mexico-border-file-120221.jpg?c=16x9&q=w_800%2Cc_fill'],[],['https://external.fkhi17-1.fna.fbcdn.net/safe_image.php?w=476&h=249&url=https%3A%2F%2Fmedia.cnn.com%2Fapi%2Fv1%2Fimages%2Fstellar%2Fprod%2F220516170426-migrants-mexico-border-file-120221.jpg%3Fc%3D16x9%26q%3Dw_800%252Cc_fill&cfs=1&jq=75&ext=jpg&utld=cnn.com&_nc_oe=7024e&_nc_sid=505865&_nc_o2e=1&ccb=3-6&_nc_hash=AQGa_CnnQCd7SWJV'],[None],,,,,,,,,,141,32,14,https://facebook.com/cnninternational/posts/10159992174009641,https://cnn.it/3LCGIeO,[],18793419640,CNN International,https://facebook.com/cnninternational/?locale2=en_US&__tn__=C-R,False,,,,,,,True,,,,,,,18793419640,,,[],False,0,0.00014454126
10159992030374641,"""The lingering unknown is this: will Kim's problems with Covid distract him from such a show of power, or will it make him more belligerent?"" | Analysis

CNN.COM
Analysis: North Korea is facing a Covid disaster. What does that mean for Kim Jong Un?","""The lingering unknown is this: will Kim's problems with Covid distract him from such a show of power, or will it make him more belligerent?"" | Analysis","CNN.COM
Analysis: North Korea is facing a Covid disaster. What does that mean for Kim Jong Un?",,2022-05-21 01:00:48,1653076848,https://cdn.cnn.com/cnnnext/dam/assets/220519111135-north-korea-covid-outbreak-super-tease.jpg,https://external.fkhi17-1.fna.fbcdn.net/safe_image.php?w=476&h=249&url=https%3A%2F%2Fcdn.cnn.com%2Fcnnnext%2Fdam%2Fassets%2F220519111135-north-korea-covid-outbreak-super-tease.jpg&cfs=1&jq=75&ext=jpg&utld=cnn.com&_nc_oe=7024d&_nc_sid=505865&_nc_o2e=1&ccb=3-6&_nc_hash=AQGa55Xtqk5DC3WT,['https://cdn.cnn.com/cnnnext/dam/assets/220519111135-north-korea-covid-outbreak-super-tease.jpg'],[],['https://external.fkhi17-1.fna.fbcdn.net/safe_image.php?w=476&h=249&url=https%3A%2F%2Fcdn.cnn.com%2Fcnnnext%2Fdam%2Fassets%2F220519111135-north-korea-covid-outbreak-super-tease.jpg&cfs=1&jq=75&ext=jpg&utld=cnn.com&_nc_oe=7024d&_nc_sid=505865&_nc_o2e=1&ccb=3-6&_nc_hash=AQGa55Xtqk5DC3WT'],[None],,,,,,,,,,82,36,27,https://facebook.com/cnninternational/posts/10159992030374641,https://cnn.it/39Ajw3D,[],18793419640,CNN International,https://facebook.com/cnninternational/?locale2=en_US&__tn__=C-R,False,,,,,,,True,,,,,,,18793419640,,,[],False,0,0.00018063188
