post_id,text,post_text,shared_text,original_text,time,timestamp,image,image_lowquality,images,images_description,images_lowquality,images_lowquality_description,video,video_duration_seconds,video_height,video_id,video_quality,video_size_MB,video_thumbnail,video_watches,video_width,likes,comments,shares,post_url,link,links,user_id,username,user_url,is_live,factcheck,shared_post_id,shared_time,shared_user_id,shared_username,shared_post_url,available,comments_full,reactors,w3_fb_url,reactions,reaction_count,with,page_id,sharers,image_id,image_ids,was_live,Sentiment,Polarity
10159995093164641,"""This episode is very unusual for mid-May and could be one of the most intense episodes in the last 20 years,"" a spokesperson for the country's national weather service said.

CNN.COM
Spain experiences record-breaking heatwave for May","""This episode is very unusual for mid-May and could be one of the most intense episodes in the last 20 years,"" a spokesperson for the country's national weather service said.","CNN.COM
Spain experiences record-breaking heatwave for May",,2022-05-22 23:00:28,1653242428,https://cdn.cnn.com/cnnnext/dam/assets/220522105045-03-spain-heatwave-may-2022-super-tease.jpg,https://external.fkhi17-1.fna.fbcdn.net/safe_image.php?w=476&h=249&url=https%3A%2F%2Fcdn.cnn.com%2Fcnnnext%2Fdam%2Fassets%2F220522105045-03-spain-heatwave-may-2022-super-tease.jpg&cfs=1&jq=75&ext=jpg&utld=cnn.com&_nc_oe=7024e&_nc_sid=505865&_nc_o2e=1&ccb=3-6&_nc_hash=AQEVgdSIMpSfAXsZ,['https://cdn.cnn.com/cnnnext/dam/assets/220522105045-03-spain-heatwave-may-2022-super-tease.jpg'],[],['https://external.fkhi17-1.fna.fbcdn.net/safe_image.php?w=476&h=249&url=https%3A%2F%2Fcdn.cnn.com%2Fcnnnext%2Fdam%2Fassets%2F220522105045-03-spain-heatwave-may-2022-super-tease.jpg&cfs=1&jq=75&ext=jpg&utld=cnn.com&_nc_oe=7024e&_nc_sid=505865&_nc_o2e=1&ccb=3-6&_nc_hash=AQEVgdSIMpSfAXsZ'],[None],,,,,,,,,,42,5,3,https://facebook.com/cnninternational/posts/10159995093164641,https://cnn.it/3LCrBSA,[],18793419640,CNN International,https://facebook.com/cnninternational/?locale2=en_US&__tn__=C-R,False,,,,,,,True,,,,,,,18793419640,,,[],False,0,0.0008790791
10159994945784641,"Veteran body language expert Janine Driver says Johnny Depp is hugging his attorney in the courtroom ""to get Amber's goat,"" that Heard's crying is ""bad, bad acting,"" and that the ""case is nuttier than a Snickers bar."" https://cnn.it/3LwNLWl","Veteran body language expert Janine Driver says Johnny Depp is hugging his attorney in the courtroom ""to get Amber's goat,"" that Heard's crying is ""bad, bad acting,"" and that the ""case is nuttier than a Snickers bar."" https://cnn.it/3LwNLWl",,,2022-05-22 21:03:46,1653235426,,https://scontent.fkhi17-1.fna.fbcdn.net/v/t15.5256-10/281539214_185878657111245_3482679017369822518_n.jpg?stp=cp0_dst-jpg_e15_q65_s320x320&_nc_cat=1&ccb=1-7&_nc_sid=ccf8b3&_nc_ohc=FwSE8En2wWAAX-LaG8k&_nc_ht=scontent.fkhi17-1.fna&oh=00_AT-yZIeLWzGbHXoP2T9GcYjX-9oErIgeqxxUdCoJeBvMRw&oe=62901A8F,[],[],['https://scontent.fkhi17-1.fna.fbcdn.net/v/t15.5256-10/281539214_185878657111245_3482679017369822518_n.jpg?stp=cp0_dst-jpg_e15_q65_s320x320&_nc_cat=1&ccb=1-7&_nc_sid=ccf8b3&_nc_ohc=FwSE8En2wWAAX-LaG8k&_nc_ht=scontent.fkhi17-1.fna&oh=00_AT-yZIeLWzGbHXoP2T9GcYjX-9oErIgeqxxUdCoJeBvMRw&oe=62901A8F'],[None],https://video.fkhi17-1.fna.fbcdn.net/v/t39.25447-2/282566512_575379490566381_167979943369252183_n.mp4?_nc_cat=100&vs=eccc3d4fbf67ca0d&_nc_vs=HBksFQAYJEdIQ2YxeER0Y0NYNlRRc0NBRmNkNmxYZXlGUUNibWRqQUFBRhUAAsgBABUAGCRHR1A2NGhBRW5kQU9YbWtJQUVRRU1jVzlmT29sYnJGcUFBQUYVAgLIAQBLBogScHJvZ3Jlc3NpdmVfcmVjaXBlATENc3Vic2FtcGxlX2ZwcwAQdm1hZl9lbmFibGVfbnN1YgAgbWVhc3VyZV9vcmlnaW5hbF9yZXNvbHV0aW9uX3NzaW0AKGNvbXB1dGVfc3NpbV9vbmx5X2F0X29yaWdpbmFsX3Jlc29sdXRpb24AEWRpc2FibGVfcG9zdF9wdnFzABUAJQAcAAAmqNKRvPW74wMVkE4oAkMzGAt2dHNfcHJldmlldxwXQG52uFHrhR8YIGRhc2hfdjRfNXNlY2dvcF9ocTFfZnJhZ18yX3ZpZGVvEgAYGHZpZGVvcy52dHMuY2FsbGJhY2sucHJvZDgSVklERU9fVklFV19SRVFVRVNUGw%2BIFW9lbV90YXJnZXRfZW5jb2RlX3RhZwZvZXBfc2QTb2VtX3JlcXVlc3RfdGltZV9tcwEwDG9lbV9jZmdfcnVsZQpzZF91bm11dGVkE29lbV9yb2lfcmVhY2hfY291bnQIMjA0NDkxMDURb2VtX2lzX2V4cGVyaW1lbnQADG9lbV9yb2lfbm90ZQtwcm9ncmVzc2l2ZRFvZW1fcm9pX3VzZXJfdGllcgAeb2VtX3JvaV9wcmVkaWN0ZWRfd2F0Y2hfdGltZV9zATAWb2VtX3JvaV9yZWNpcGVfYmVuZWZpdAUwLjAwMCVvZW1fcm9pX3N0YXRpY19iZW5lZml0X2Nvc3RfZXZhbHVhdG9yC3Byb2dyZXNzaXZlDG9lbV92aWRlb19pZA83Mzc5Mzk5MDcyMzY5OTESb2VtX3ZpZGVvX2Fzc2V0X2lkDzcyNDExNTUzMjM2NDA4NxVvZW1fdmlkZW9fcmVzb3VyY2VfaWQQMTA2MzE1NzYxMTI0Njc0MBxvZW1fc291cmNlX3ZpZGVvX2VuY29kaW5nX2lkDzUxNDc5ODU1NzAzODAzNQ52dHNfcmVxdWVzdF9pZA8yZGIzMGFmYmI3ZjM0Y2MlAhwcHBXw5hcbAVUAAhsBVQACHBUCAAAAFoC6twMAJb4BGweIAXMENjAzNAJjZAoyMDIyLTA1LTIyA3JjYggyMDQ0OTEwMANhcHAKU29jaWFsRmxvdwJjdBlDT05UQUlORURfUE9TVF9BVFRBQ0hNRU5UE29yaWdpbmFsX2R1cmF0aW9uX3MKMjQzLjczMzMzMwJ0cxRwcm9ncmVzc2l2ZV9vcmRlcmluZwA%3D&ccb=1-7&_nc_sid=a92414&_nc_ohc=1lYodoVKUp4AX-jlzIU&_nc_rml=0&_nc_ht=video.fkhi17-1.fna&oh=00_AT9FQLcU7R1vPD7HDKXy6V99Q88yaRfAQbRYxqlKB5DGnw&oe=62904944&_nc_rid=680810212408293,,,737939907236991.0,,,https://scontent.fkhi17-1.fna.fbcdn.net/v/t15.5256-10/281539214_185878657111245_3482679017369822518_n.jpg?stp=cp0_dst-jpg_e15_q65_s320x320&_nc_cat=1&ccb=1-7&_nc_sid=ccf8b3&_nc_ohc=FwSE8En2wWAAX-LaG8k&_nc_ht=scontent.fkhi17-1.fna&oh=00_AT-yZIeLWzGbHXoP2T9GcYjX-9oErIgeqxxUdCoJeBvMRw&oe=62901A8F,,,174,57,0,https://facebook.com/cnninternational/posts/10159994945784641,https://cnn.it/3LwNLWl,"[{'link': 'https://lm.facebook.com/l.php?u=https%3A%2F%2Fcnn.it%2F3LwNLWl&h=AT0M3EIkqWuGATWYGdmTST_ukYmEM-oARN5VaJuCc5l05vcBi2NFKumiaM_YP3huMzNYGmQarwUqV7B48taVbI5wrzhsO29pg4XFZy6gwanyEKm4EfWRggqMweaZ4egrA9drqKcOS7OSR-Z0KWS0-lva7DyQhpCs-ypS20Q4JxZuRDdD3e4O_I8dRZ40', 'text': 'https://cnn.it/3LwNLWl'}]",18793419640,CNN International,https://facebook.com/cnninternational/?locale2=en_US&__tn__=C-R,False,,,,,,,True,,,,,,,18793419640,,,[],False,0,0.0022613704
10159994861629641,"Trevor Reed, an American citizen recently freed after more than two years imprisoned in Russia, said in an exclusive interview with CNN that he does not believe the United States' participation in prisoner swaps to bring Americans home should be controversial.

EDITION.CNN.COM
Exclusive: Trevor Reed pushes back against critics of US participation in prisoner swaps","Trevor Reed, an American citizen recently freed after more than two years imprisoned in Russia, said in an exclusive interview with CNN that he does not believe the United States' participation in prisoner swaps to bring Americans home should be controversial.","EDITION.CNN.COM
Exclusive: Trevor Reed pushes back against critics of US participation in prisoner swaps",,2022-05-22 20:01:23,1653231683,https://cdn.cnn.com/cnnnext/dam/assets/220520145929-trevor-reed-detainment-still-super-tease.jpg,https://external.fkhi17-1.fna.fbcdn.net/safe_image.php?w=476&h=249&url=https%3A%2F%2Fcdn.cnn.com%2Fcnnnext%2Fdam%2Fassets%2F220520145929-trevor-reed-detainment-still-super-tease.jpg&cfs=1&jq=75&ext=jpg&utld=cnn.com&_nc_oe=7024e&_nc_sid=505865&_nc_o2e=1&ccb=3-6&_nc_hash=AQFIcgfBh_21N929,['https://cdn.cnn.com/cnnnext/dam/assets/220520145929-trevor-reed-detainment-still-super-tease.jpg'],[],['https://external.fkhi17-1.fna.fbcdn.net/safe_image.php?w=476&h=249&url=https%3A%2F%2Fcdn.cnn.com%2Fcnnnext%2Fdam%2Fassets%2F220520145929-trevor-reed-detainment-still-super-tease.jpg&cfs=1&jq=75&ext=jpg&utld=cnn.com&_nc_oe=7024e&_nc_sid=505865&_nc_o2e=1&ccb=3-6&_nc_hash=AQFIcgfBh_21N929'],[None],,,,,,,,,,59,7,9,https://facebook.com/cnninternational/posts/10159994861629641,https://cnn.it/3wyMKJi,[],18793419640,CNN International,https://facebook.com/cnninternational/?locale2=en_US&__tn__=C-R,False,,,,,,,True,,,,,,,18793419640,,,[],False,0,0.2875316
10159994796624641,"""Japanese Prime Minister Fumio Kishida is a man on a mission,"" write Emiko Jozuka and Blake Essig.

EDITION.CNN.COM
Japan steps out of US' shadow as China threat grows | Analysis","""Japanese Prime Minister Fumio Kishida is a man on a mission,"" write Emiko Jozuka and Blake Essig.","EDITION.CNN.COM
Japan steps out of US' shadow as China threat grows | Analysis",,2022-05-22 19:02:11,1653228131,https://cdn.cnn.com/cnnnext/dam/assets/220412173238-06-nansei-islands-japan-super-tease.jpg,https://external.fkhi17-1.fna.fbcdn.net/safe_image.php?w=476&h=249&url=https%3A%2F%2Fcdn.cnn.com%2Fcnnnext%2Fdam%2Fassets%2F220412173238-06-nansei-islands-japan-super-tease.jpg&cfs=1&jq=75&ext=jpg&utld=cnn.com&_nc_oe=7024e&_nc_sid=505865&_nc_o2e=1&ccb=3-6&_nc_hash=AQFuE7h044iehyh_,['https://cdn.cnn.com/cnnnext/dam/assets/220412173238-06-nansei-islands-japan-super-tease.jpg'],[],['https://external.fkhi17-1.fna.fbcdn.net/safe_image.php?w=476&h=249&url=https%3A%2F%2Fcdn.cnn.com%2Fcnnnext%2Fdam%2Fassets%2F220412173238-06-nansei-islands-japan-super-tease.jpg&cfs=1&jq=75&ext=jpg&utld=cnn.com&_nc_oe=7024e&_nc_sid=505865&_nc_o2e=1&ccb=3-6&_nc_hash=AQFuE7h044iehyh_'],[None],,,,,,,,,,79,12,3,https://facebook.com/cnninternational/posts/10159994796624641,https://cnn.it/3yQ3vB4,[],18793419640,CNN International,https://facebook.com/cnninternational/?locale2=en_US&__tn__=C-R,False,,,,,,,True,,,,,,,18793419640,,,[],False,0,0.00043302774
10159994700199641,"An 11-page memo released publicly by the Miami-Dade Fire Rescue Department last week said the ""voice in the rubble"" belonged to Theresa Velasquez, a Live Nation music executive who was 36 when she perished, along with her parents.

EDITION.CNN.COM
The woman whose voice was heard in rubble of the Surfside condo collapse has been identified. This is how it happened","An 11-page memo released publicly by the Miami-Dade Fire Rescue Department last week said the ""voice in the rubble"" belonged to Theresa Velasquez, a Live Nation music executive who was 36 when she perished, along with her parents.","EDITION.CNN.COM
The woman whose voice was heard in rubble of the Surfside condo collapse has been identified. This is how it happened",,2022-05-22 17:31:19,1653222679,https://cdn.cnn.com/cnnnext/dam/assets/220520114316-02b-velasquez-missing-building-collapse-super-tease.jpg,https://external.fkhi17-1.fna.fbcdn.net/safe_image.php?w=476&h=249&url=https%3A%2F%2Fcdn.cnn.com%2Fcnnnext%2Fdam%2Fassets%2F220520114316-02b-velasquez-missing-building-collapse-super-tease.jpg&cfs=1&jq=75&ext=jpg&utld=cnn.com&_nc_oe=7024e&_nc_sid=505865&_nc_o2e=1&ccb=3-6&_nc_hash=AQG7lRW1qPGllpn-,['https://cdn.cnn.com/cnnnext/dam/assets/220520114316-02b-velasquez-missing-building-collapse-super-tease.jpg'],[],['https://external.fkhi17-1.fna.fbcdn.net/safe_image.php?w=476&h=249&url=https%3A%2F%2Fcdn.cnn.com%2Fcnnnext%2Fdam%2Fassets%2F220520114316-02b-velasquez-missing-building-collapse-super-tease.jpg&cfs=1&jq=75&ext=jpg&utld=cnn.com&_nc_oe=7024e&_nc_sid=505865&_nc_o2e=1&ccb=3-6&_nc_hash=AQG7lRW1qPGllpn-'],[None],,,,,,,,,,197,19,16,https://facebook.com/cnninternational/posts/10159994700199641,https://cnn.it/39Mphvj,[],18793419640,CNN International,https://facebook.com/cnninternational/?locale2=en_US&__tn__=C-R,False,,,,,,,True,,,,,,,18793419640,,,[],False,0,0.0021315515
10159994651064641,"""Carbon capture and sequestration,"" or CCS, is hardly the term that rolls off the tongue at dinner parties -- even in the age of increasing unnatural disasters.

EDITION.CNN.COM
Meet the guy who wants to help save the planet with thousands of buoys, seaweed and giant antacids","""Carbon capture and sequestration,"" or CCS, is hardly the term that rolls off the tongue at dinner parties -- even in the age of increasing unnatural disasters.","EDITION.CNN.COM
Meet the guy who wants to help save the planet with thousands of buoys, seaweed and giant antacids",,2022-05-22 16:45:10,1653219910,https://cdn.cnn.com/cnnnext/dam/assets/220520164653-01-seaweed-carbon-capture-xprize-finalist-climate-super-tease.jpg,https://external.fkhi17-1.fna.fbcdn.net/safe_image.php?w=476&h=249&url=https%3A%2F%2Fcdn.cnn.com%2Fcnnnext%2Fdam%2Fassets%2F220520164653-01-seaweed-carbon-capture-xprize-finalist-climate-super-tease.jpg&cfs=1&jq=75&ext=jpg&utld=cnn.com&_nc_oe=7024e&_nc_sid=505865&_nc_o2e=1&ccb=3-6&_nc_hash=AQHDzsKTCUAmv2R6,['https://cdn.cnn.com/cnnnext/dam/assets/220520164653-01-seaweed-carbon-capture-xprize-finalist-climate-super-tease.jpg'],[],['https://external.fkhi17-1.fna.fbcdn.net/safe_image.php?w=476&h=249&url=https%3A%2F%2Fcdn.cnn.com%2Fcnnnext%2Fdam%2Fassets%2F220520164653-01-seaweed-carbon-capture-xprize-finalist-climate-super-tease.jpg&cfs=1&jq=75&ext=jpg&utld=cnn.com&_nc_oe=7024e&_nc_sid=505865&_nc_o2e=1&ccb=3-6&_nc_hash=AQHDzsKTCUAmv2R6'],[None],,,,,,,,,,116,10,7,https://facebook.com/cnninternational/posts/10159994651064641,https://cnn.it/3sOb6fC,[],18793419640,CNN International,https://facebook.com/cnninternational/?locale2=en_US&__tn__=C-R,False,,,,,,,True,,,,,,,18793419640,,,[],False,0,0.4732598
10159994548484641,"A guilt-ridden Russian officer says he resigned from the military out of shame for the invasion of Ukraine.

""People around us were dying,"" he told CNN. ""I didn't want to feel like I was part of it, but I was a part of it.""

EDITION.CNN.COM
Russian officer reveals why he risked it all to quit Putin's war","A guilt-ridden Russian officer says he resigned from the military out of shame for the invasion of Ukraine.

""People around us were dying,"" he told CNN. ""I didn't want to feel like I was part of it, but I was a part of it.""","EDITION.CNN.COM
Russian officer reveals why he risked it all to quit Putin's war",,2022-05-22 15:02:08,1653213728,https://cdn.cnn.com/cnnnext/dam/assets/220521191928-01-ukraine-russian-officer-resigns-super-tease.jpg,https://external.fkhi17-1.fna.fbcdn.net/safe_image.php?w=476&h=249&url=https%3A%2F%2Fcdn.cnn.com%2Fcnnnext%2Fdam%2Fassets%2F220521191928-01-ukraine-russian-officer-resigns-super-tease.jpg&cfs=1&jq=75&ext=jpg&utld=cnn.com&_nc_oe=7024e&_nc_sid=505865&_nc_o2e=1&ccb=3-6&_nc_hash=AQHiJ5kNcUKrnEGo,['https://cdn.cnn.com/cnnnext/dam/assets/220521191928-01-ukraine-russian-officer-resigns-super-tease.jpg'],[],['https://external.fkhi17-1.fna.fbcdn.net/safe_image.php?w=476&h=249&url=https%3A%2F%2Fcdn.cnn.com%2Fcnnnext%2Fdam%2Fassets%2F220521191928-01-ukraine-russian-officer-resigns-super-tease.jpg&cfs=1&jq=75&ext=jpg&utld=cnn.com&_nc_oe=7024e&_nc_sid=505865&_nc_o2e=1&ccb=3-6&_nc_hash=AQHiJ5kNcUKrnEGo'],[None],,,,,,,,,,1129,391,83,https://facebook.com/cnninternational/posts/10159994548484641,https://cnn.it/3sOHxL7,[],18793419640,CNN International,https://facebook.com/cnninternational/?locale2=en_US&__tn__=C-R,False,,,,,,,True,,,,,,,18793419640,,,[],False,0,0.03508556
10159994195994641,"Sunday's game at the Etihad has the potential to offer plenty of plot twists.

CNN.COM
Premier League title race goes down to the wire, but Manchester City holds advantage | CNN",Sunday's game at the Etihad has the potential to offer plenty of plot twists.,"CNN.COM
Premier League title race goes down to the wire, but Manchester City holds advantage | CNN",,2022-05-22 09:00:54,1653192054,https://media.cnn.com/api/v1/images/stellar/prod/220521085457-02-premier-league-manchester-city-liverpool-spt-intl.jpg?c=16x9&q=w_800%2Cc_fill,https://external.fkhi17-1.fna.fbcdn.net/safe_image.php?w=476&h=249&url=https%3A%2F%2Fmedia.cnn.com%2Fapi%2Fv1%2Fimages%2Fstellar%2Fprod%2F220521085457-02-premier-league-manchester-city-liverpool-spt-intl.jpg%3Fc%3D16x9%26q%3Dw_800%252Cc_fill&cfs=1&jq=75&ext=jpg&utld=cnn.com&_nc_oe=7024e&_nc_sid=505865&_nc_o2e=1&ccb=3-6&_nc_hash=AQEKVc1B--I4FWky,['https://media.cnn.com/api/v1/images/stellar/prod/220521085457-02-premier-league-manchester-city-liverpool-spt-intl.jpg?c=16x9&q=w_800%2Cc_fill'],[],['https://external.fkhi17-1.fna.fbcdn.net/safe_image.php?w=476&h=249&url=https%3A%2F%2Fmedia.cnn.com%2Fapi%2Fv1%2Fimages%2Fstellar%2Fprod%2F220521085457-02-premier-league-manchester-city-liverpool-spt-intl.jpg%3Fc%3D16x9%26q%3Dw_800%252Cc_fill&cfs=1&jq=75&ext=jpg&utld=cnn.com&_nc_oe=7024e&_nc_sid=505865&_nc_o2e=1&ccb=3-6&_nc_hash=AQEKVc1B--I4FWky'],[None],,,,,,,,,,127,17,9,https://facebook.com/cnninternational/posts/10159994195994641,https://cnn.it/3yROdfs,[],18793419640,CNN International,https://facebook.com/cnninternational/?locale2=en_US&__tn__=C-R,False,,,,,,,True,,,,,,,18793419640,,,[],False,0,0.44680074
10159994156104641,"President Joe Biden will conclude a visit to South Korea on Sunday visiting with some of the nearly 30,000 American service members stationed here.

CNN.COM
Biden set to wrap up South Korean leg of his first Asia trip as President with visit to US troops","President Joe Biden will conclude a visit to South Korea on Sunday visiting with some of the nearly 30,000 American service members stationed here.","CNN.COM
Biden set to wrap up South Korean leg of his first Asia trip as President with visit to US troops",,2022-05-22 08:30:23,1653190223,https://cdn.cnn.com/cnnnext/dam/assets/220521012146-04-biden-asia-052122-super-tease.jpg,https://external.fkhi17-1.fna.fbcdn.net/safe_image.php?w=476&h=249&url=https%3A%2F%2Fcdn.cnn.com%2Fcnnnext%2Fdam%2Fassets%2F220521012146-04-biden-asia-052122-super-tease.jpg&cfs=1&jq=75&ext=jpg&utld=cnn.com&_nc_oe=7024e&_nc_sid=505865&_nc_o2e=1&ccb=3-6&_nc_hash=AQG0jrUuJP0adv9r,['https://cdn.cnn.com/cnnnext/dam/assets/220521012146-04-biden-asia-052122-super-tease.jpg'],[],['https://external.fkhi17-1.fna.fbcdn.net/safe_image.php?w=476&h=249&url=https%3A%2F%2Fcdn.cnn.com%2Fcnnnext%2Fdam%2Fassets%2F220521012146-04-biden-asia-052122-super-tease.jpg&cfs=1&jq=75&ext=jpg&utld=cnn.com&_nc_oe=7024e&_nc_sid=505865&_nc_o2e=1&ccb=3-6&_nc_hash=AQG0jrUuJP0adv9r'],[None],,,,,,,,,,136,29,14,https://facebook.com/cnninternational/posts/10159994156104641,https://cnn.it/3sPKGu6,[],18793419640,CNN International,https://facebook.com/cnninternational/?locale2=en_US&__tn__=C-R,False,,,,,,,True,,,,,,,18793419640,,,[],False,0,0.0032702386
10159994102889641,"The horse, with odds of 5-1, put on a strong finish, passing runner ups down the stretch.

CNN.COM
Early Voting wins Preakness Stakes","The horse, with odds of 5-1, put on a strong finish, passing runner ups down the stretch.","CNN.COM
Early Voting wins Preakness Stakes",,2022-05-22 07:30:18,1653186618,https://cdn.cnn.com/cnnnext/dam/assets/220521181843-preakness-early-voting-super-tease.jpg,https://external.fkhi17-1.fna.fbcdn.net/safe_image.php?w=476&h=249&url=https%3A%2F%2Fcdn.cnn.com%2Fcnnnext%2Fdam%2Fassets%2F220521181843-preakness-early-voting-super-tease.jpg&cfs=1&jq=75&ext=jpg&utld=cnn.com&_nc_oe=7024e&_nc_sid=505865&_nc_o2e=1&ccb=3-6&_nc_hash=AQGfoYueiS5RXzOd,['https://cdn.cnn.com/cnnnext/dam/assets/220521181843-preakness-early-voting-super-tease.jpg'],[],['https://external.fkhi17-1.fna.fbcdn.net/safe_image.php?w=476&h=249&url=https%3A%2F%2Fcdn.cnn.com%2Fcnnnext%2Fdam%2Fassets%2F220521181843-preakness-early-voting-super-tease.jpg&cfs=1&jq=75&ext=jpg&utld=cnn.com&_nc_oe=7024e&_nc_sid=505865&_nc_o2e=1&ccb=3-6&_nc_hash=AQGfoYueiS5RXzOd'],[None],,,,,,,,,,80,5,14,https://facebook.com/cnninternational/posts/10159994102889641,https://cnn.it/3yQKXkh,[],18793419640,CNN International,https://facebook.com/cnninternational/?locale2=en_US&__tn__=C-R,False,,,,,,,True,,,,,,,18793419640,,,[],False,0,0.0010592341
10159993863539641,"Lyon stunned Champions League holders Barcelona 3-1 to win a record-extending eighth title.

CNN.COM
Lyon stuns holders Barcelona to win eighth Champions League title",Lyon stunned Champions League holders Barcelona 3-1 to win a record-extending eighth title.,"CNN.COM
Lyon stuns holders Barcelona to win eighth Champions League title",,2022-05-22 04:00:14,1653174014,https://cdn.cnn.com/cnnnext/dam/assets/220521184121-amandine-henry-celebrate-womens-champions-league-final-super-tease.jpg,https://external.fkhi17-1.fna.fbcdn.net/safe_image.php?w=476&h=249&url=https%3A%2F%2Fcdn.cnn.com%2Fcnnnext%2Fdam%2Fassets%2F220521184121-amandine-henry-celebrate-womens-champions-league-final-super-tease.jpg&cfs=1&jq=75&ext=jpg&utld=cnn.com&_nc_oe=7024d&_nc_sid=505865&_nc_o2e=1&ccb=3-6&_nc_hash=AQE8Gtb2ql9neS6r,['https://cdn.cnn.com/cnnnext/dam/assets/220521184121-amandine-henry-celebrate-womens-champions-league-final-super-tease.jpg'],[],['https://external.fkhi17-1.fna.fbcdn.net/safe_image.php?w=476&h=249&url=https%3A%2F%2Fcdn.cnn.com%2Fcnnnext%2Fdam%2Fassets%2F220521184121-amandine-henry-celebrate-womens-champions-league-final-super-tease.jpg&cfs=1&jq=75&ext=jpg&utld=cnn.com&_nc_oe=7024d&_nc_sid=505865&_nc_o2e=1&ccb=3-6&_nc_hash=AQE8Gtb2ql9neS6r'],[None],,,,,,,,,,239,10,14,https://facebook.com/cnninternational/posts/10159993863539641,https://cnn.it/3ME4EzM,[],18793419640,CNN International,https://facebook.com/cnninternational/?locale2=en_US&__tn__=C-R,False,,,,,,,True,,,,,,,18793419640,,,[],False,0,0.00013127923
10159993674689641,"The unidentified woman is seen emerging from behind photographers and quickly removing her dress before making her way onto the carpet and shouting at cameras.

CNN.COM
Woman storms Cannes red carpet denouncing sexual violence in Ukraine",The unidentified woman is seen emerging from behind photographers and quickly removing her dress before making her way onto the carpet and shouting at cameras.,"CNN.COM
Woman storms Cannes red carpet denouncing sexual violence in Ukraine",,2022-05-22 02:00:08,1653166808,https://cdn.cnn.com/cnnnext/dam/assets/220521112717-01-cannes-ukraine-protester-super-tease.jpg,https://external.fkhi17-1.fna.fbcdn.net/safe_image.php?w=476&h=249&url=https%3A%2F%2Fcdn.cnn.com%2Fcnnnext%2Fdam%2Fassets%2F220521112717-01-cannes-ukraine-protester-super-tease.jpg&cfs=1&jq=75&ext=jpg&utld=cnn.com&_nc_oe=7024d&_nc_sid=505865&_nc_o2e=1&ccb=3-6&_nc_hash=AQHpUTpBagBN0CuX,['https://cdn.cnn.com/cnnnext/dam/assets/220521112717-01-cannes-ukraine-protester-super-tease.jpg'],[],['https://external.fkhi17-1.fna.fbcdn.net/safe_image.php?w=476&h=249&url=https%3A%2F%2Fcdn.cnn.com%2Fcnnnext%2Fdam%2Fassets%2F220521112717-01-cannes-ukraine-protester-super-tease.jpg&cfs=1&jq=75&ext=jpg&utld=cnn.com&_nc_oe=7024d&_nc_sid=505865&_nc_o2e=1&ccb=3-6&_nc_hash=AQHpUTpBagBN0CuX'],[None],,,,,,,,,,168,54,30,https://facebook.com/cnninternational/posts/10159993674689641,https://cnn.it/3yVeclY,[],18793419640,CNN International,https://facebook.com/cnninternational/?locale2=en_US&__tn__=C-R,False,,,,,,,True,,,,,,,18793419640,,,[],False,0,0.00018817186
10159993382954641,"A 17-year-old Palestinian was killed and an 18-year-old was critically injured by Israeli fire during an Israeli military raid in Jenin in the West Bank Saturday, the Palestinian Ministry of Health said

CNN.COM
Palestinian teen shot and killed in exchange of fire with Israeli military in Jenin","A 17-year-old Palestinian was killed and an 18-year-old was critically injured by Israeli fire during an Israeli military raid in Jenin in the West Bank Saturday, the Palestinian Ministry of Health said","CNN.COM
Palestinian teen shot and killed in exchange of fire with Israeli military in Jenin",,2022-05-21 22:00:18,1653152418,https://cdn.cnn.com/cnnnext/dam/assets/220521103728-01-palestinian-teen-shot-0521-super-tease.jpg,https://external.fkhi17-1.fna.fbcdn.net/safe_image.php?w=476&h=249&url=https%3A%2F%2Fcdn.cnn.com%2Fcnnnext%2Fdam%2Fassets%2F220521103728-01-palestinian-teen-shot-0521-super-tease.jpg&cfs=1&jq=75&ext=jpg&utld=cnn.com&_nc_oe=7024e&_nc_sid=505865&_nc_o2e=1&ccb=3-6&_nc_hash=AQFjaUzqpVzwXIgF,['https://cdn.cnn.com/cnnnext/dam/assets/220521103728-01-palestinian-teen-shot-0521-super-tease.jpg'],[],['https://external.fkhi17-1.fna.fbcdn.net/safe_image.php?w=476&h=249&url=https%3A%2F%2Fcdn.cnn.com%2Fcnnnext%2Fdam%2Fassets%2F220521103728-01-palestinian-teen-shot-0521-super-tease.jpg&cfs=1&jq=75&ext=jpg&utld=cnn.com&_nc_oe=7024e&_nc_sid=505865&_nc_o2e=1&ccb=3-6&_nc_hash=AQFjaUzqpVzwXIgF'],[None],,,,,,,,,,467,368,63,https://facebook.com/cnninternational/posts/10159993382954641,https://cnn.it/3yQAsNL,[],18793419640,CNN International,https://facebook.com/cnninternational/?locale2=en_US&__tn__=C-R,False,,,,,,,True,,,,,,,18793419640,,,[],False,0,9.2552546e-05
10159993016619641,"Australian Labor Party leader Anthony Albanese will be the country's next Prime Minister, according to projections by three major news networks

CNN.COM
Labor leader Anthony Albanese to become Australia's next Prime Minister, networks report | CNN","Australian Labor Party leader Anthony Albanese will be the country's next Prime Minister, according to projections by three major news networks","CNN.COM
Labor leader Anthony Albanese to become Australia's next Prime Minister, networks report | CNN",,2022-05-21 17:05:58,1653134758,https://s3.amazonaws.com/prod-cust-photo-posts-jfaikqealaka/f55084d2-bbec-82df-0789-664ed7b9a1d7.jpeg,https://external.fkhi17-1.fna.fbcdn.net/safe_image.php?w=476&h=249&url=https%3A%2F%2Fs3.amazonaws.com%2Fprod-cust-photo-posts-jfaikqealaka%2Ff55084d2-bbec-82df-0789-664ed7b9a1d7.jpeg&cfs=1&jq=75&ext=jpg&utld=amazonaws.com&_nc_oe=7024d&_nc_sid=505865&_nc_o2e=1&ccb=3-6&_nc_hash=AQG4qbVUbTfi28_7,['https://s3.amazonaws.com/prod-cust-photo-posts-jfaikqealaka/f55084d2-bbec-82df-0789-664ed7b9a1d7.jpeg'],[],['https://external.fkhi17-1.fna.fbcdn.net/safe_image.php?w=476&h=249&url=https%3A%2F%2Fs3.amazonaws.com%2Fprod-cust-photo-posts-jfaikqealaka%2Ff55084d2-bbec-82df-0789-664ed7b9a1d7.jpeg&cfs=1&jq=75&ext=jpg&utld=amazonaws.com&_nc_oe=7024d&_nc_sid=505865&_nc_o2e=1&ccb=3-6&_nc_hash=AQG4qbVUbTfi28_7'],[None],,,,,,,,,,146,22,24,https://facebook.com/cnninternational/posts/10159993016619641,https://cnn.it/3LAw5cr,[],18793419640,CNN International,https://facebook.com/cnninternational/?locale2=en_US&__tn__=C-R,False,,,,,,,True,,,,,,,18793419640,,,[],False,0,0.027760386
